{
  "schema": "emsim/scenario-file/v1",
  "key": "dds-district-tree-cycle-01",
  "version": 1,
  "title": "ДДС района: дерево перекрыло проезд — полный цикл реагирования",
  "origin": "manual",
  "body": {
    "schema": "emsim/scenario/v1",
    "target_service": "dds_district_chertanovo",
    "card": {
      "number": "882107",
      "registered_at_offset_s": -40,
      "applicant": { "name": "Кузнецов, водитель", "phone": "+77495127731", "status": "witness" },
      "address": {
        "country": "Россия", "city": "Москва", "okrug": "ЮАО", "district": "Чертаново Южное",
        "street": "Россошанская улица", "house": "7", "building": "1",
        "text": "Россия, Москва, (ЮАО, Чертаново Южное), Россошанская улица, 7, к. 1"
      },
      "incident": {
        "type_code": "14080106", "type_name": "Дерево упало во дворе",
        "features": { "объект": "Дерево", "состояние": "Упало, сломано", "место": "Дворовый проезд" },
        "description": "Упавшее дерево перекрыло дворовый проезд к дому, машины не могут проехать. Пострадавших нет.", "victims": 0
      },
      "notification_list": [{ "service": "dds_district_chertanovo", "status": "added", "mine": true }],
      "phones": { "aon": "+77495127731", "provided": "+7 (749) 512-77-31" }
    },
    "contacts": [{
      "key": "crew_leader", "label": "Руководитель аварийной бригады", "number": "4152", "voice": "crew_leader_recorded",
      "phrases": { "greeting": "Диспетчерская, руководитель бригады, слушаю вас.", "ack": "Информация принята. Бригада направлена по указанному адресу." }
    }],
    "events": [
      { "key": "e1", "at_s": 20, "since": "accepted", "delivery": "notice", "from": "crew_leader", "voice": false,
        "text": "Бригада выехала, будем на месте через 15 минут.",
        "expects": { "status": "responding", "within_s": 30, "action": "set_status" } },
      { "key": "e2", "at_s": 45, "since": "accepted", "delivery": "notice", "from": "crew_leader", "voice": false,
        "text": "Бригада на месте.",
        "expects": { "status": "arrived", "within_s": 30, "action": "set_status" } },
      { "key": "e3", "at_s": 70, "since": "accepted", "delivery": "notice", "from": "crew_leader", "voice": false,
        "text": "Приступили к распилу, для крупных веток вызвали автовышку.",
        "expects": { "status": "working", "within_s": 30, "action": "set_status" } },
      { "key": "e4", "at_s": 100, "since": "accepted", "delivery": "notice", "from": "crew_leader", "voice": false,
        "text": "Работы закончены, дерево убрано, проезд свободен.",
        "expects": { "status": "completed", "within_s": 30, "action": "set_status" } }
    ],
    "reference": {
      "primary_decision": { "status": "accepted", "comment_required": false },
      "expected_chain": ["responding", "arrived", "working", "completed"],
      "call": { "required": true, "to": "crew_leader", "must_mention": ["address", "incident_type"], "before_status": "responding" },
      "field_corrections": [],
      "guide_refs": ["Памятка ДДС, стр. 21–26: статусы реагирования и правила их проставления"],
      "notes": "Профильное происшествие на территории района: «Принята», звонок руководителю бригады, затем статусы хода работ по докладам бригады; в комментарии к «Проведению работ» — вызов автовышки, к «Работам завершены» — итог."
    },
    "difficulty": 2, "exercise_type": "dds_processing"
  }
}
