{
  "schema": "emsim/scenario-file/v1",
  "key": "dds-district-urn-fire-01",
  "version": 1,
  "title": "ДДС района: горит урна у пешеходного перехода",
  "origin": "manual",
  "body": {
    "schema": "emsim/scenario/v1",
    "target_service": "dds_district_chertanovo",
    "card": {
      "number": "883202",
      "registered_at_offset_s": -30,
      "applicant": {
        "name": "Орешкин Никита Сергеевич",
        "phone": "+79260884512",
        "status": "witness"
      },
      "address": {
        "country": "Россия",
        "city": "Москва",
        "okrug": "ЮАО",
        "district": "Чертаново Южное",
        "street": "Кировоградская улица",
        "house": "34",
        "landmark": "у пешеходного перехода",
        "text": "Россия, Москва, (ЮАО, Чертаново Южное), Кировоградская улица, 34"
      },
      "incident": {
        "type_code": "01010101",
        "type_name": "пожар: мусор",
        "features": {
          "где": "Улица",
          "признак": "Открытое пламя / Дым",
          "объект": "Мусор",
          "место": "Пешеходный переход",
          "угроза людям": "Нет"
        },
        "description": "Прохожий: у пешеходного перехода горит мусорная урна, открытое пламя около полуметра, никто не пострадал.",
        "victims": 0
      },
      "notification_list": [
        {
          "service": "dds_district_chertanovo",
          "status": "added",
          "mine": true
        }
      ],
      "phones": {
        "aon": "+79260884512",
        "provided": "+7 (926) 088-45-12"
      }
    },
    "contacts": [
      {
        "key": "crew_leader",
        "role": "crew",
        "label": "Мастер ГБУ «Жилищник района Чертаново Южное»",
        "number": "4154",
        "voice": "crew_leader_recorded",
        "phrases": {
          "greeting": "Диспетчерская, руководитель бригады, слушаю вас.",
          "ack": "Информация принята. Бригада направлена по указанному адресу."
        }
      },
      {
        "key": "control",
        "role": "control_112",
        "label": "Отдел контроля реагирования 112",
        "number": "0112",
        "voice": "female_calm",
        "phrases": {
          "greeting": "Отдел контроля реагирования Службы 112, слушаю.",
          "ack": "Информацию приняли, спасибо."
        }
      },
      {
        "key": "applicant",
        "role": "applicant",
        "label": "Заявитель Орешкин",
        "number": "4512",
        "voice": "male_calm",
        "phrases": {
          "greeting": "Да, слушаю.",
          "ack": "Понял, спасибо."
        }
      }
    ],
    "events": [
      {
        "key": "e1",
        "at_s": 15,
        "since": "call_ended",
        "since_contact": "crew_leader",
        "delivery": "notice",
        "from": "crew_leader",
        "voice": false,
        "text": "Бригада выехала к переходу на Кировоградской.",
        "expects": {
          "status": "responding",
          "within_s": 30,
          "action": "set_status"
        }
      },
      {
        "key": "e2",
        "at_s": 35,
        "since": "call_ended",
        "since_contact": "crew_leader",
        "delivery": "notice",
        "from": "crew_leader",
        "voice": false,
        "text": "На месте. Урну потушили пожарные, она оплавилась.",
        "expects": {
          "status": "arrived",
          "within_s": 30,
          "action": "set_status"
        }
      },
      {
        "key": "e3",
        "at_s": 55,
        "since": "call_ended",
        "since_contact": "crew_leader",
        "delivery": "notice",
        "from": "crew_leader",
        "voice": false,
        "text": "Снимаем сгоревшую урну, убираем мусор.",
        "expects": {
          "status": "working",
          "within_s": 30,
          "action": "set_status"
        }
      },
      {
        "key": "e4",
        "at_s": 80,
        "since": "call_ended",
        "since_contact": "crew_leader",
        "delivery": "phone_incoming",
        "from": "crew_leader",
        "voice": false,
        "text": "Диспетчер, установили новую урну, место убрано. Работы закончены.",
        "expects": {
          "status": "completed",
          "within_s": 30,
          "action": "set_status",
          "comment_facts": [
            "установлена новая урна"
          ]
        }
      }
    ],
    "reference": {
      "primary_decision": {
        "status": "accepted",
        "comment_required": false
      },
      "expected_chain": [
        "responding",
        "arrived",
        "working",
        "completed"
      ],
      "call": {
        "required": true,
        "to": "crew_leader",
        "must_mention": [
          "address",
          "incident_type"
        ],
        "before_status": "responding"
      },
      "guide_refs": [
        "Памятка ДДС, стр. 21–26: статусы реагирования и правила их проставления"
      ],
      "notes": "Простой профильный случай: «Принята», звонок руководителю бригады, статусы по докладам, в итоговом комментарии — замена урны. Адрес перенесён в Чертаново Южное. Сценарий переведён из кейса 112 «112-garbage-fire-crosswalk-mira-01»: заявитель, суть и описание — из его эталона.",
      "field_corrections": []
    },
    "difficulty": 2,
    "exercise_type": "dds_processing"
  }
}
