{
  "schema": "emsim/scenario-file/v1",
  "key": "pilot-112-ai-toyota-fire-01",
  "version": 2,
  "title": "ИИ-заявитель: горит Toyota, у водителя ожоги",
  "origin": "manual",
  "body": {
    "schema": "emsim/scenario/v1",
    "exercise_type": "operator112_intake",
    "difficulty": 4,
    "intake112": {
      "mode": "full_case",
      "caller_mode": "free_text",
      "call": {
        "aon": "+79161313132",
        "local_time": "02:03",
        "time_zone": "Europe/Moscow"
      },
      "dialogue": {
        "caller": {
          "persona": "Ты — очевидец возгорания автомобиля. Взволнована из-за водителя с ожогами рук; сама находишься рядом с торговым центром.",
          "opening": {
            "id": "opening",
            "text": "Горит белая Toyota, у водителя ожоги рук. Ему 54 года. Срочно нужна помощь!",
            "reveals": [
              "complaint",
              "applicant_status",
              "car_fire",
              "driver_burns",
              "driver_age"
            ]
          }
        },
        "facts": [
          {
            "id": "complaint",
            "label": "Жалобы",
            "card_path": "/complaint",
            "knowledge": "initial",
            "value": "горит автомобиль Toyota, у водителя ожоги рук",
            "statement": "У нас горит машина, у водителя ожоги.",
            "disclosure_patterns": [
              "горит.*машин",
              "горит.*тойот",
              "ожог"
            ]
          },
          {
            "id": "applicant_status",
            "label": "Статус заявителя",
            "card_path": "/applicant_status",
            "knowledge": "initial",
            "value": "witness",
            "statement": "Я свидетель, сама не пострадала.",
            "disclosure_patterns": [
              "свидетел",
              "не пострадал"
            ]
          },
          {
            "id": "car_fire",
            "label": "Возгорание автомобиля",
            "knowledge": "initial",
            "value": "горит белый автомобиль Toyota",
            "statement": "Горит белый автомобиль Toyota.",
            "disclosure_patterns": [
              "горит.*тойот",
              "бел.*тойот"
            ]
          },
          {
            "id": "driver_burns",
            "label": "Ожоги водителя",
            "knowledge": "initial",
            "value": "у водителя ожоги рук",
            "statement": "У водителя ожоги рук.",
            "disclosure_patterns": [
              "ожог.*рук",
              "рук.*ожог"
            ]
          },
          {
            "id": "driver_age",
            "label": "Возраст водителя",
            "knowledge": "initial",
            "value": "54",
            "statement": "Водителю 54 года.",
            "disclosure_patterns": [
              "54 года",
              "пятьдесят четыре"
            ]
          },
          {
            "id": "vehicle_plate",
            "label": "Номер автомобиля",
            "knowledge": "on_question",
            "value": "Р 254 ТС 99",
            "statement": "Номер автомобиля — Р 254 ТС 99.",
            "ask_patterns": [
              "номер автомобил",
              "госномер",
              "какой номер"
            ],
            "disclosure_patterns": [
              "р ?254 ?тс ?99"
            ]
          },
          {
            "id": "driver_name",
            "label": "Имя водителя",
            "knowledge": "on_question",
            "value": "Дюжев Юрий Петрович",
            "statement": "Водителя зовут Дюжев Юрий Петрович.",
            "ask_patterns": [
              "как зовут водител",
              "имя пострадав",
              "фамилия водителя"
            ],
            "disclosure_patterns": [
              "дюжев",
              "юрий петрович"
            ]
          },
          {
            "id": "address",
            "label": "Адрес",
            "card_path": "/address/descriptive",
            "knowledge": "on_question",
            "value": "Москва, станция метро «Отрадное», рядом с торговым комплексом «Золотой Вавилон»",
            "statement": "Адрес: Москва, станция метро «Отрадное», рядом с торговым комплексом «Золотой Вавилон».",
            "ask_patterns": [
              "адрес",
              "где (вы |ты )?(находитесь|находишься|сейчас|стоите|находится)",
              "какая улица",
              "назовите.*(дом|улицу)"
            ],
            "ask_exclude_patterns": [
              "ориентировк",
              "местоположени"
            ],
            "disclosure_patterns": [
              "отрадн",
              "золот.*вавилон",
              "адрес"
            ]
          },
          {
            "id": "landmark",
            "label": "Ориентир",
            "card_path": "/address/landmark",
            "knowledge": "on_question",
            "value": "торговый комплекс «Золотой Вавилон» рядом, улица Декабристов",
            "statement": "Мы на подъездной дороге, автомобиль на улице Декабристов, торговый комплекс справа.",
            "ask_patterns": [
              "где именно",
              "в каком именно месте",
              "ориентир",
              "что рядом",
              "как вас найти"
            ],
            "disclosure_patterns": [
              "декабристов",
              "справа",
              "торгов"
            ]
          },
          {
            "id": "name",
            "label": "ФИО заявителя",
            "card_path": "/applicant_name",
            "knowledge": "on_question",
            "value": "Фролова Яна Игоревна",
            "statement": "Меня зовут Фролова Яна Игоревна.",
            "ask_patterns": [
              "как вас зовут",
              "представьтесь",
              "назовите.*(ваше )?имя"
            ],
            "disclosure_patterns": [
              "фролова"
            ]
          },
          {
            "id": "phone",
            "label": "Телефон заявителя",
            "card_path": "/provided_phone",
            "knowledge": "on_question",
            "value": "+79161239878",
            "statement": "Мой номер телефона: +7 916 123-98-78.",
            "ask_patterns": [
              "номер телефона",
              "ваш телефон",
              "номер для связи",
              "перезвонить"
            ]
          },
          {
            "id": "age",
            "label": "Возраст заявителя",
            "card_path": "/age",
            "knowledge": "on_question",
            "value": "36",
            "statement": "Мне 36 лет.",
            "ask_patterns": [
              "сколько вам лет",
              "ваш возраст",
              "назовите.*возраст"
            ],
            "disclosure_patterns": [
              "36 лет",
              "тридцать шесть"
            ]
          },
          {
            "id": "victims_count",
            "label": "Число пострадавших",
            "card_path": "/victims_count",
            "knowledge": "on_question",
            "value": "1",
            "statement": "Пострадал только водитель, один человек.",
            "ask_patterns": [
              "сколько пострадавш",
              "есть ли пострадавш",
              "кто-нибудь пострадал"
            ],
            "disclosure_patterns": [
              "один человек",
              "только водител"
            ]
          }
        ]
      },
      "reference": {
        "expected_types": [
          "road_traffic_fire"
        ],
        "case_description": "Свидетель ДТП: горит автомобиль, у водителя ожоги рук. Карта 101 (ДТП с пламенем), служба pilot_fire_101. Эталон близок к настоящему — тип и служба отражают реальную ситуацию сценария, в отличие от двух других кейсов ИИ-заявителя в этом наборе, где каталог типов 112 не покрывает ситуацию.",
        "expected_services": [
          "pilot_fire_101"
        ],
        "description_questions": [
          {
            "id": "car",
            "question": "Указано ли, что горит белая Toyota?"
          },
          {
            "id": "burns",
            "question": "Указано ли, что у водителя ожоги рук?"
          },
          {
            "id": "age",
            "question": "Указано ли, что водителю 54 года?"
          },
          {
            "id": "name",
            "question": "Указано ли ФИО водителя — Дюжев Юрий Петрович?"
          }
        ]
      }
    }
  }
}
