{
  "schema": "emsim/scenario-file/v1",
  "key": "dds-district-gas-hallway-01",
  "version": 1,
  "title": "ДДС района: запах газа в квартире на Россошанской — полный цикл",
  "origin": "manual",
  "body": {
    "schema": "emsim/scenario/v1",
    "target_service": "dds_district_chertanovo",
    "card": {
      "number": "883201",
      "registered_at_offset_s": -30,
      "applicant": {
        "name": "Лебедев Виктор Семёнович",
        "phone": "+74953184467",
        "status": "victim"
      },
      "address": {
        "country": "Россия",
        "city": "Москва",
        "okrug": "ЮАО",
        "district": "Чертаново Южное",
        "street": "Россошанская улица",
        "house": "7",
        "building": "2",
        "entrance": "3",
        "floor": "9",
        "flat": "115",
        "text": "Россия, Москва, (ЮАО, Чертаново Южное), Россошанская улица, 7, к. 2, под. 3, эт. 9, кв. 115"
      },
      "incident": {
        "type_code": "13020600",
        "type_name": "Запах бытового газа (прочее, в помещении)",
        "features": {
          "где": "В помещении (в квартире, в доме)",
          "от чего": "Прочее",
          "пострадавшие": "Да"
        },
        "description": "Пенсионер 67 лет, живёт один: в прихожей пахнет газом, темнеет в глазах и кружится голова. Источник запаха неизвестен.",
        "victims": 1
      },
      "notification_list": [
        {
          "service": "dds_district_chertanovo",
          "status": "added",
          "mine": true
        }
      ],
      "phones": {
        "aon": "+74953184467",
        "provided": "+7 (495) 318-44-67"
      }
    },
    "contacts": [
      {
        "key": "crew_leader",
        "role": "crew",
        "label": "Мастер ГБУ «Жилищник района Чертаново Южное»",
        "number": "4153",
        "voice": "crew_leader_recorded",
        "phrases": {
          "greeting": "Диспетчерская, руководитель бригады, слушаю вас.",
          "ack": "Информация принята. Мастер выезжает, обеспечим доступ в подъезд."
        }
      },
      {
        "key": "control",
        "role": "control_112",
        "label": "Отдел контроля реагирования 112",
        "number": "0112",
        "voice": "female_calm",
        "phrases": {
          "greeting": "Отдел контроля реагирования Службы 112, слушаю.",
          "ack": "Информацию приняли, спасибо."
        }
      },
      {
        "key": "applicant",
        "role": "applicant",
        "label": "Заявитель Лебедев",
        "number": "4467",
        "voice": "male_calm",
        "phrases": {
          "greeting": "Алло… Лебедев слушает.",
          "ack": "Хорошо, спасибо."
        }
      }
    ],
    "events": [
      {
        "key": "e1",
        "at_s": 15,
        "since": "call_ended",
        "since_contact": "crew_leader",
        "delivery": "notice",
        "from": "crew_leader",
        "voice": false,
        "text": "Мастер выехал к Россошанской, 7к2, будет через 10 минут.",
        "expects": {
          "status": "responding",
          "within_s": 30,
          "action": "set_status"
        }
      },
      {
        "key": "e2",
        "at_s": 35,
        "since": "call_ended",
        "since_contact": "crew_leader",
        "delivery": "phone_incoming",
        "from": "crew_leader",
        "voice": false,
        "text": "Диспетчер, мастер на месте, газовая служба и скорая работают, открыли подвал.",
        "expects": {
          "status": "arrived",
          "within_s": 30,
          "action": "set_status"
        }
      },
      {
        "key": "e3",
        "at_s": 60,
        "since": "call_ended",
        "since_contact": "crew_leader",
        "delivery": "notice",
        "from": "crew_leader",
        "voice": false,
        "text": "По указанию газовой службы перекрыт газовый стояк третьего подъезда, жильцов предупредили.",
        "expects": {
          "status": "working",
          "within_s": 30,
          "action": "set_status",
          "comment_facts": [
            "перекрыт газовый стояк",
            "жильцы предупреждены"
          ]
        }
      },
      {
        "key": "e4",
        "at_s": 85,
        "since": "call_ended",
        "since_contact": "crew_leader",
        "delivery": "phone_incoming",
        "from": "crew_leader",
        "voice": false,
        "text": "Диспетчер, утечку на вводе в квартиру 115 устранили, газ в подъезд подан. Работы закончены.",
        "expects": {
          "status": "completed",
          "within_s": 30,
          "action": "set_status",
          "comment_facts": [
            "утечка устранена",
            "газ подан"
          ]
        }
      }
    ],
    "reference": {
      "primary_decision": {
        "status": "accepted",
        "comment_required": false
      },
      "expected_chain": [
        "responding",
        "arrived",
        "working",
        "completed"
      ],
      "call": {
        "required": true,
        "to": "crew_leader",
        "must_mention": [
          "address",
          "incident_type"
        ],
        "before_status": "responding"
      },
      "guide_refs": [
        "Памятка ДДС, стр. 21–26: статусы реагирования и правила их проставления"
      ],
      "notes": "Происшествие на территории района: «Принята», звонок мастеру «Жилищника»; статусы по докладам, в комментариях — перекрытие стояка и итог. Сценарий переведён из кейса 112 «112-gas-hallway-chertanovo-01»: заявитель, суть и описание — из его эталона.",
      "field_corrections": []
    },
    "difficulty": 5,
    "exercise_type": "dds_processing"
  }
}
