{
  "schema": "emsim/scenario-file/v1",
  "key": "dds-district-tree-cycle-01",
  "version": 2,
  "title": "ДДС района: дерево перекрыло проезд — полный цикл реагирования",
  "origin": "manual",
  "body": {
    "schema": "emsim/scenario/v1",
    "target_service": "dds_district_chertanovo",
    "card": {
      "number": "882107",
      "registered_at_offset_s": -40,
      "applicant": { "name": "Кузнецов, водитель", "phone": "+77495127731", "status": "witness" },
      "address": {
        "country": "Россия", "city": "Москва", "okrug": "ЮАО", "district": "Чертаново Южное",
        "street": "Россошанская улица", "house": "7", "building": "1",
        "text": "Россия, Москва, (ЮАО, Чертаново Южное), Россошанская улица, 7, к. 1"
      },
      "incident": {
        "type_code": "14080106", "type_name": "Дерево упало во дворе",
        "features": { "объект": "Дерево", "состояние": "Упало, сломано", "место": "Дворовый проезд" },
        "description": "Упавшее дерево перекрыло дворовый проезд к дому, машины не могут проехать. Пострадавших нет.", "victims": 0
      },
      "notification_list": [{ "service": "dds_district_chertanovo", "status": "added", "mine": true }],
      "phones": { "aon": "+77495127731", "provided": "+7 (749) 512-77-31" }
    },
    "contacts": [
      { "key": "crew_leader", "role": "crew", "label": "Руководитель аварийной бригады", "number": "4152", "voice": "crew_leader_recorded",
        "phrases": { "greeting": "Диспетчерская, руководитель бригады, слушаю вас.", "ack": "Информация принята. Бригада направлена по указанному адресу." } },
      { "key": "control", "role": "control_112", "label": "Отдел контроля реагирования 112", "number": "0112", "voice": "female_calm",
        "phrases": { "greeting": "Отдел контроля реагирования Службы 112, слушаю.", "ack": "Информацию приняли, спасибо." } },
      { "key": "applicant", "role": "applicant", "label": "Заявитель Кузнецов", "number": "7731", "voice": "male_calm",
        "phrases": { "greeting": "Алло, Кузнецов слушает.", "ack": "Понял, спасибо, ждём." } }
    ],
    "events": [
      { "key": "e1", "at_s": 15, "since": "call_ended", "since_contact": "crew_leader", "delivery": "notice", "from": "crew_leader", "voice": false,
        "text": "Бригада выехала, будем на месте через 15 минут.",
        "expects": { "status": "responding", "within_s": 30, "action": "set_status" } },
      { "key": "e2", "at_s": 35, "since": "call_ended", "since_contact": "crew_leader", "delivery": "phone_incoming", "from": "crew_leader", "voice": false,
        "text": "Диспетчер, это бригада. Мы на месте, дерево лежит поперёк проезда.",
        "expects": { "status": "arrived", "within_s": 30, "action": "set_status" } },
      { "key": "e3", "at_s": 60, "since": "call_ended", "since_contact": "crew_leader", "delivery": "notice", "from": "crew_leader", "voice": false,
        "text": "Приступили к распилу, для крупных веток вызвали автовышку.",
        "expects": { "status": "working", "within_s": 30, "action": "set_status", "comment_facts": ["вызвана автовышка"] } },
      { "key": "e4", "at_s": 85, "since": "call_ended", "since_contact": "crew_leader", "delivery": "phone_incoming", "from": "crew_leader", "voice": false,
        "text": "Диспетчер, работы закончены: дерево распилили и вывезли, проезд свободен.",
        "expects": { "status": "completed", "within_s": 30, "action": "set_status", "comment_facts": ["дерево убрано", "проезд свободен"] } }
    ],
    "reference": {
      "primary_decision": { "status": "accepted", "comment_required": false },
      "expected_chain": ["responding", "arrived", "working", "completed"],
      "call": { "required": true, "to": "crew_leader", "must_mention": ["address", "incident_type"], "before_status": "responding" },
      "field_corrections": [],
      "guide_refs": ["Памятка ДДС, стр. 21–26: статусы реагирования и правила их проставления"],
      "notes": "Профильное происшествие на территории района: «Принята», звонок руководителю бригады, доклады бригады приходят только после звонка руководителю бригады (ADR-031), два из них — входящими звонками; статусы хода работ ставятся по докладам; в комментарии к «Проведению работ» — вызов автовышки, к «Работам завершены» — итог."
    },
    "difficulty": 2, "exercise_type": "dds_processing"
  }
}
