{
  "schema": "emsim/scenario-file/v1",
  "key": "dds-district-ebus-fire-01",
  "version": 1,
  "title": "ДДС района: горит электробус на площадке отстоя",
  "origin": "manual",
  "body": {
    "schema": "emsim/scenario/v1",
    "target_service": "dds_district_chertanovo",
    "card": {
      "number": "883204",
      "registered_at_offset_s": -30,
      "applicant": {
        "name": "Смирнов Павел Викторович",
        "phone": "+79035571846",
        "status": "witness"
      },
      "address": {
        "country": "Россия",
        "city": "Москва",
        "okrug": "ЮАО",
        "district": "Чертаново Южное",
        "street": "Днепропетровская улица",
        "house": "41",
        "landmark": "площадка отстоя электробусов",
        "text": "Россия, Москва, (ЮАО, Чертаново Южное), Днепропетровская улица, 41"
      },
      "incident": {
        "type_code": "01020101",
        "type_name": "пожар: автобус",
        "features": {
          "где": "Транспорт",
          "признак": "Открытое пламя / Дым",
          "транспорт": "Общественный транспорт",
          "угроза людям": "Неизвестно",
          "мед. помощь": "Неизвестно"
        },
        "description": "Водитель проезжающего электробуса: на площадке отстоя горит стоящий электробус борт 7045, дым и пламя из отсека батарей на крыше, рядом ещё два электробуса. Есть ли люди внутри — неизвестно.",
        "victims": 0
      },
      "notification_list": [
        {
          "service": "dds_district_chertanovo",
          "status": "added",
          "mine": true
        }
      ],
      "phones": {
        "aon": "+79035571846",
        "provided": "+7 (903) 557-18-46"
      }
    },
    "contacts": [
      {
        "key": "crew_leader",
        "role": "crew",
        "label": "Руководитель бригады ГБУ «Автомобильные дороги ЮАО»",
        "number": "4156",
        "voice": "crew_leader_recorded",
        "phrases": {
          "greeting": "Диспетчерская, руководитель бригады, слушаю вас.",
          "ack": "Информация принята. Бригада выезжает с ограждением."
        }
      },
      {
        "key": "control",
        "role": "control_112",
        "label": "Отдел контроля реагирования 112",
        "number": "0112",
        "voice": "female_calm",
        "phrases": {
          "greeting": "Отдел контроля реагирования Службы 112, слушаю.",
          "ack": "Информацию приняли, спасибо."
        }
      },
      {
        "key": "applicant",
        "role": "applicant",
        "label": "Заявитель Смирнов",
        "number": "1846",
        "voice": "male_calm",
        "phrases": {
          "greeting": "Смирнов, слушаю.",
          "ack": "Понял, отъехал на безопасное расстояние."
        }
      }
    ],
    "events": [
      {
        "key": "e1",
        "at_s": 15,
        "since": "call_ended",
        "since_contact": "crew_leader",
        "delivery": "notice",
        "from": "crew_leader",
        "voice": false,
        "text": "Бригада выехала, везём ограждение.",
        "expects": {
          "status": "responding",
          "within_s": 30,
          "action": "set_status"
        }
      },
      {
        "key": "e2",
        "at_s": 30,
        "since": "call_ended",
        "since_contact": "crew_leader",
        "delivery": "phone_incoming",
        "from": "control",
        "voice": false,
        "text": "Отдел контроля 112: по пожару электробуса на Днепропетровской — подтвердите, что ваша бригада направлена."
      },
      {
        "key": "e3",
        "at_s": 45,
        "since": "call_ended",
        "since_contact": "crew_leader",
        "delivery": "phone_incoming",
        "from": "crew_leader",
        "voice": false,
        "text": "Диспетчер, на месте. Пожарные тушат, людей в электробусе не было. Ограждаем площадку.",
        "expects": {
          "status": "arrived",
          "within_s": 30,
          "action": "set_status",
          "comment_facts": [
            "людей в электробусе не было"
          ]
        }
      },
      {
        "key": "e4",
        "at_s": 70,
        "since": "call_ended",
        "since_contact": "crew_leader",
        "delivery": "notice",
        "from": "crew_leader",
        "voice": false,
        "text": "Пожар потушен, ждём эвакуатор Мосгортранса, проезд частично перекрыт.",
        "expects": {
          "status": "working",
          "within_s": 30,
          "action": "set_status",
          "comment_facts": [
            "вызван эвакуатор",
            "проезд частично перекрыт"
          ]
        }
      },
      {
        "key": "e5",
        "at_s": 100,
        "since": "call_ended",
        "since_contact": "crew_leader",
        "delivery": "phone_incoming",
        "from": "crew_leader",
        "voice": false,
        "text": "Диспетчер, электробус эвакуирован, площадка убрана, проезд открыт. Работы закончены.",
        "expects": {
          "status": "completed",
          "within_s": 30,
          "action": "set_status",
          "comment_facts": [
            "электробус эвакуирован",
            "проезд открыт"
          ]
        }
      }
    ],
    "reference": {
      "primary_decision": {
        "status": "accepted",
        "comment_required": false
      },
      "expected_chain": [
        "responding",
        "arrived",
        "working",
        "completed"
      ],
      "call": {
        "required": true,
        "to": "crew_leader",
        "must_mention": [
          "address",
          "incident_type"
        ],
        "before_status": "responding"
      },
      "guide_refs": [
        "Памятка ДДС, стр. 21–26: статусы реагирования и правила их проставления"
      ],
      "notes": "Сложный случай: кроме докладов бригады — входящий звонок отдела контроля 112, на который нужно ответить. «Принята», звонок руководителю бригады; в комментариях — отсутствие людей, эвакуатор, перекрытие и итог. Адрес перенесён в Чертаново Южное. Сценарий переведён из кейса 112 «112-transport-fire-ebus-vdnh-01»: заявитель, суть и описание — из его эталона.",
      "required_contacts": [
        "crew_leader",
        "control"
      ],
      "field_corrections": []
    },
    "difficulty": 7,
    "exercise_type": "dds_processing"
  }
}
