{
  "schema": "emsim/scenario-file/v1",
  "key": "dds-district-not-ours-metro-01",
  "version": 1,
  "title": "ДДС района: запах газа у тоннеля на «Римской» — чужая территория",
  "origin": "manual",
  "body": {
    "schema": "emsim/scenario/v1",
    "target_service": "dds_district_chertanovo",
    "card": {
      "number": "883213",
      "registered_at_offset_s": -30,
      "applicant": {
        "name": "Орлов Денис Игоревич",
        "phone": "+79857724519",
        "status": "witness"
      },
      "address": {
        "country": "Россия",
        "city": "Москва",
        "okrug": "ЦАО",
        "district": "Таганский",
        "street": "площадь Ильича",
        "house": "б/н",
        "landmark": "станция метро «Римская», у тоннеля в сторону «Крестьянской заставы»",
        "text": "Россия, Москва, (ЦАО, Таганский), площадь Ильича, б/н"
      },
      "incident": {
        "type_code": "13010200",
        "type_name": "Запах бытового газа в метро (тоннеле)",
        "features": {
          "где": "Метро (тоннель)",
          "признаки": "Неизвестно",
          "пострадавшие": "Нет"
        },
        "description": "Машинист метро после смены на станции «Римская»: сильнейший запах газа у тоннеля в сторону «Крестьянской заставы», пострадавших нет.",
        "victims": 0
      },
      "notification_list": [
        {
          "service": "dds_district_chertanovo",
          "status": "added",
          "mine": true
        }
      ],
      "phones": {
        "aon": "+79857724519",
        "provided": "+7 (985) 772-45-19"
      }
    },
    "contacts": [
      {
        "key": "control",
        "role": "control_112",
        "label": "Отдел контроля реагирования 112",
        "number": "0112",
        "voice": "female_calm",
        "phrases": {
          "greeting": "Отдел контроля реагирования Службы 112, слушаю.",
          "ack": "Информацию приняли, спасибо."
        }
      }
    ],
    "events": [],
    "reference": {
      "primary_decision": {
        "status": "not_accepted",
        "reason_tags": [
          "territory"
        ],
        "comment_required": true,
        "comment_must_mention": [
          "не наша территория",
          "передано в ДДС района Таганский"
        ]
      },
      "expected_chain": [],
      "call": {
        "required": false
      },
      "guide_refs": [
        "Памятка ДДС, стр. 24–25: «Не принята» — комментарий обязателен; стр. 28–29: карточка чужой территории"
      ],
      "notes": "Станция «Римская» (Таганский район, ЦАО) — не территория района Чертаново Южное; признак «метро» не делает происшествие профильным. Верное решение: «Не принята» с комментарием, что территория не наша и карточка передана в ДДС района Таганский. Сценарий переведён из кейса 112 «112-gas-metro-rimskaya-01»: заявитель, суть и описание — из его эталона.",
      "field_corrections": []
    },
    "difficulty": 4,
    "exercise_type": "dds_processing"
  }
}
